
item_number,title,quantity,price,topic
1,How to get a good grade in DOS in 40 minutes a day,18,100,distributed systems
2,RPCs for Noobs,20,50,distributed systems
3,Xen and the Art of Surviving Undergraduate School,18,150,undergraduate school
4,Cooking for the Impatient Undergrad,20,20,undergraduate school
5,Spring in the Pioneer Valley,15,90,regional interest
6,Mastering Docker for Beginners,25,180,software engineering
7,The Art of Debugging Code,12,140,programming
8,Time Management for Busy Students,30,110,productivity

